{
  "$schema": "https://json-schema.org/draft/2020-12/schema",
  "$id": "https://neverhuman.org/schemas/bullet.paper-evidence.v1.json",
  "title": "Bullet Farm paper evidence",
  "type": "object",
  "additionalProperties": false,
  "required": [
    "schema_version",
    "snapshot",
    "repositories",
    "toolchain",
    "commands",
    "results",
    "maturity",
    "external_observations",
    "artifact_hashes"
  ],
  "properties": {
    "schema_version": { "const": "bullet.paper-evidence.v1" },
    "snapshot": {
      "type": "object",
      "additionalProperties": false,
      "required": ["id", "captured_at", "source_date_epoch", "stage", "family_clean", "transaction_proof"],
      "properties": {
        "id": { "type": "string", "minLength": 1 },
        "captured_at": { "type": "string", "format": "date-time" },
        "source_date_epoch": { "type": "integer", "minimum": 1 },
        "stage": { "enum": ["architecture-component-assurance", "benchmarked-revision"] },
        "family_clean": { "type": "boolean" },
        "transaction_proof": { "type": "boolean" }
      }
    },
    "repositories": {
      "type": "array",
      "minItems": 4,
      "maxItems": 4,
      "items": {
        "type": "object",
        "additionalProperties": false,
        "required": ["name", "path", "commit", "tree", "clean_at_capture"],
        "properties": {
          "name": { "enum": ["bullet-farm", "bullet-kernel", "bullet-git", "bullet-portal"] },
          "path": { "type": "string" },
          "commit": { "type": "string", "pattern": "^[0-9a-f]{40}$" },
          "tree": { "type": "string", "pattern": "^[0-9a-f]{40}$" },
          "clean_at_capture": { "type": "boolean" }
        }
      }
    },
    "toolchain": { "type": "object" },
    "commands": { "type": "array", "minItems": 1 },
    "results": { "type": "object" },
    "maturity": {
      "type": "array",
      "const": ["Designed", "Component-proved", "Transaction-proved", "Live/release-proved"]
    },
    "external_observations": { "type": "array" },
    "artifact_hashes": { "type": "array" }
  }
}
