{
  "schema_version": "bullet.paper-evidence.v1",
  "snapshot": {
    "id": "20260825-stage1",
    "captured_at": "2026-08-25T06:15:00Z",
    "source_date_epoch": 1787638500,
    "stage": "architecture-component-assurance",
    "family_clean": false,
    "transaction_proof": false
  },
  "repositories": [
    {"name":"bullet-farm","path":"bullet-farm","commit":"f33750c1411262d59610ae903c1cb890e7fbb77b","tree":"e1822b29ea5276bbe12f63736e72e7b3a2db1309","clean_at_capture":false},
    {"name":"bullet-kernel","path":"bullet-kernel","commit":"419d8a6832ee3a0d1f717e907fa9c60753e62780","tree":"176a48462583498f5f8dc4c52b16f18f293d7ef1","clean_at_capture":false},
    {"name":"bullet-git","path":"bullet-git","commit":"236f4efe2b8243b3c4dd5da13269e45119b061df","tree":"ac02f8d492d0767f3a3e490eff0e897e99fc08ba","clean_at_capture":false},
    {"name":"bullet-portal","path":"bullet-portal","commit":"95108e37d64364a25426cb65d320650c6bcf8b4d","tree":"50ee4db5f3b9729545af9b3a20c3ae88648c2a00","clean_at_capture":false}
  ],
  "toolchain": {
    "rustc":"rustc 1.95.0 (59807616e 2026-04-14)",
    "cargo":"cargo 1.95.0 (f2d3ce0bd 2026-03-21)",
    "git":"git version 2.43.0",
    "just":"just 1.58.0",
    "jq":"jq-1.7",
    "pdflatex":"pdfTeX 3.141592653-2.6-1.40.25 (TeX Live 2023/Debian)",
    "bibtex":"BibTeX 0.99d (TeX Live 2023/Debian)",
    "poppler":"pdfinfo version 24.02.0"
  },
  "commands": [
    {"repository":"bullet-farm","command":"cargo run --locked --quiet --bin bullet-family -- doctor --json","outcome":"BLOCKED","exit_code":0,"boundary":"Read-only family installation inventory; unsupported schema-2 lock remains blocked by design"},
    {"repository":"bullet-farm","command":"cargo run --locked --quiet --bin bullet-family -- check release --json","outcome":"BLOCKED","exit_code":3,"boundary":"26 blocked of 26 evaluated release gates; negative inventory only"},
    {"repository":"bullet-farm","command":"just fast","outcome":"PASS","exit_code":0,"boundary":"Hub fast component lane; not a family transaction"},
    {"repository":"bullet-farm","command":"just demo","outcome":"PASS","exit_code":0,"boundary":"Deterministic demonstration; not a TRANSACTION_PROOF or LIVE_PROOF"},
    {"repository":"bullet-farm","command":"just contract","outcome":"PASS","exit_code":0,"boundary":"Generated wire/contract component proof"},
    {"repository":"bullet-farm","command":"cargo test --locked -p bullet-wire --test policy_registry","outcome":"PASS","exit_code":0,"boundary":"Machine registry validation; planned invariants remain unimplemented"},
    {"repository":"bullet-farm","command":"just audit","outcome":"PASS_COMPONENT_BLOCKED_FOR_RELEASE","exit_code":0,"boundary":"Deterministic local audit; score, caps, hard findings, and missing portable hosted artifact block release"},
    {"repository":"bullet-farm","command":"bash formal/model-check.sh","outcome":"PASS","exit_code":0,"boundary":"Two bounded safety models at pinned state counts; not a system proof"},
    {"repository":"bullet-kernel","command":"bash scripts/ci-local.sh required","outcome":"PASS","exit_code":0,"boundary":"Kernel component and contract tests only"},
    {"repository":"bullet-git","command":"bash scripts/ci-local.sh required","outcome":"PASS","exit_code":0,"boundary":"BulletGit component and contract tests only"},
    {"repository":"bullet-portal","command":"bash scripts/ci-local.sh required","outcome":"PASS","exit_code":0,"boundary":"Portal component, bundle, and browser fixtures only"}
  ],
  "results": {
    "doctor":{"outcome":"BLOCKED","reason":"UNSUPPORTED_SCHEMA and stale checked family.lock are retained fail-closed"},
    "release_gates":{"outcome":"BLOCKED","evaluated":26,"blocked":26},
    "fast":{"outcome":"PASS","evidence_class":"Component-proved"},
    "demo":{"outcome":"PASS","evidence_class":"Component-proved","transaction_gate_eligible":false},
    "formal":{"outcome":"PASS","models":2,"scope":"bounded safety only"},
    "invariant_registry":{"outcome":"PASS","tests":10,"enforced_gate0_entries":3},
    "audit":{"outcome":"PASS_COMPONENT_BLOCKED_FOR_RELEASE","score":58,"raw_score":58,"caps":10,"hard_findings":29,"soft_findings":15,"portable_hosted_artifact":false},
    "transaction_proof":{"outcome":"ABSENT"},
    "live_proof":{"outcome":"ABSENT"},
    "release_proof":{"outcome":"ABSENT"}
  },
  "maturity": ["Designed","Component-proved","Transaction-proved","Live/release-proved"],
  "external_observations": [
    {"name":"Gas Town","subject":"v1.2.1 / 319d33a91b2deca59bba6dd26be6b9daf8eaacf6","observed_at":"2026-08-25","url":"https://github.com/gastownhall/gastown/releases/tag/v1.2.1"},
    {"name":"Gas City","subject":"v1.4.1 / 58ef17e3bd685fd5cf7f21286277b208d3324590","observed_at":"2026-08-25","url":"https://github.com/gastownhall/gascity/releases/tag/v1.4.1"},
    {"name":"DeepSeek Harness","subject":"dsh-v0.1.1-rc.2 / b150a551b8d465e31e418e1b2eaf5e79bbb7d28e","observed_at":"2026-08-25","url":"https://github.com/deepseek-ai/DeepSeek-Harness/releases/tag/dsh-v0.1.1-rc.2"},
    {"name":"Omnigent","subject":"v0.10.0 / 40755dd8dddb07e1eb6e4055d1d9936e184ceb9b","observed_at":"2026-08-25","url":"https://github.com/omnigent-ai/omnigent/releases/tag/v0.10.0"},
    {"name":"Open-source landscape commits","subject":"Gemini CLI 812f7a2; OpenHands 150e760; SWE-agent 3ea751c; mini-SWE-agent 25941c8; Aider 5dc9490; Cline 4f5f238; Continue 5522c6f; Goose f1d32e8; Roo b867ec9; ACP 5acaa3a; MCP 57ac4a2","observed_at":"2026-08-25","url":"https://github.com/"},
    {"name":"Proprietary coding-agent landscape","subject":"Official documentation only; black-box limitations apply","observed_at":"2026-08-25","url":"https://developers.openai.com/codex/"}
  ],
  "artifact_hashes": [
    {"path":"../repos.manifest.toml","sha256":"5639ce51dcbb31a38c306b7227bcf06a7bafb6358478ac3f65ad96fadb74d525"},
    {"path":"family.lock","sha256":"46f962883530104df3f1ebff9887c48a130f224cf4f1a9e2f579e2a2d1e7f9ee"},
    {"path":"docs/release.md","sha256":"7ba9c8bf3d0343f1c89c25063110dee9e985750143da58103cb3ca687016167b"},
    {"path":"docs/assurance/invariant-registry.md","sha256":"b64fcf4dfeb22e3e15cf836547a047b5e593967845c076907729548e136b20a3"},
    {"path":"formal/model-lock.json","sha256":"d9f231b85898623b8770302b7f3b23e4e2e6804b73d348b53baadebbc8297f4f"},
    {"path":"formal/toolchain.lock.json","sha256":"495b4d878c72bf4385bd7167ee68199cf780047e3e4042b2c06d2834d58f5c7e"},
    {"path":"policy/v1alpha1/policy.json","sha256":"0c6581c27988b2c9c31ce1a31dfed4b78ab44953b2e85ce5ba1839f0de465e5b"},
    {"path":"docs/assurance/competitor-snapshot.md","sha256":"af70bba8bb4b41b38922b74ded2fa0230610e37289541b05b20ce0101dae6471"}
  ]
}
